{
  "$schema": "http://json-schema.org/draft-07/schema#",
  "$id": "https://nba-sim/config/schemas/duration.schema.json",
  "title": "NBA Sim Clocks & Duration Model (foundation 0.1.0)",
  "description": "Authoritative clock rules (period, OT, shot clock, backcourt), resolution + quantization rule, duration sampling distributions for every gameplay micro-segment, and start-reason mode biases that drive possession length in v0.1.0. Frozen alongside docs/foundation/clocks-duration.md (T6).",
  "type": "object",
  "required": [
    "foundation_version",
    "resolution_seconds",
    "quantize_rule",
    "clocks",
    "made_fg_stoppage",
    "durations",
    "start_reason_bias"
  ],
  "additionalProperties": false,
  "properties": {
    "foundation_version": {
      "type": "string",
      "pattern": "^\\d+\\.\\d+\\.\\d+$",
      "description": "Semver stamp of the duration/clock contract. Must match config/foundation.json#foundation_version."
    },
    "resolution_seconds": {
      "type": "number",
      "const": 0.1,
      "description": "Game-clock quantum. All sampled durations are rounded to this resolution per the quantize_rule. Pinned at 0.1 for v0.1.0; changing it is a major foundation_version bump."
    },
    "quantize_rule": {
      "type": "string",
      "pattern": "^Math\\.round\\(.*\\* 10\\) / 10$",
      "description": "JavaScript expression string documenting how a raw sampled delta (seconds) is snapped to the resolution. v0.1.0 freeze (decision M7): Math.round(delta_raw * 10) / 10. The engine evaluates this semantically; the regex here only guards the canonical form."
    },
    "clocks": {
      "type": "object",
      "required": [
        "period_seconds",
        "overtime_seconds",
        "shot_clock_full",
        "shot_clock_reset",
        "backcourt_seconds"
      ],
      "additionalProperties": false,
      "properties": {
        "period_seconds": {
          "type": "integer",
          "minimum": 1,
          "const": 720,
          "description": "Regulation quarter length: 12:00 = 720 seconds. Pinned for v0.1.0."
        },
        "overtime_seconds": {
          "type": "integer",
          "minimum": 1,
          "const": 300,
          "description": "Overtime period length: 5:00 = 300 seconds. Pinned for v0.1.0 (decision M6)."
        },
        "shot_clock_full": {
          "type": "integer",
          "minimum": 1,
          "const": 24,
          "description": "Full shot clock reset value. Pinned for v0.1.0."
        },
        "shot_clock_reset": {
          "type": "integer",
          "minimum": 1,
          "const": 14,
          "description": "Partial shot clock reset value used in the v0.1.0 subset of triggers (see Shot Clock Reset Rules). Pinned for v0.1.0."
        },
        "backcourt_seconds": {
          "type": "integer",
          "minimum": 1,
          "const": 8,
          "description": "Time to legally advance past the time line. Pinned for v0.1.0."
        }
      }
    },
    "made_fg_stoppage": {
      "type": "object",
      "required": [
        "last_minute_periods_q1_q2_q3",
        "last_two_minutes_q4_ot"
      ],
      "additionalProperties": false,
      "properties": {
        "last_minute_periods_q1_q2_q3": {
          "type": "boolean",
          "const": true,
          "description": "Game clock stops after a made field goal in the final 1:00 of Q1, Q2, and Q3. Pinned true for v0.1.0."
        },
        "last_two_minutes_q4_ot": {
          "type": "boolean",
          "const": true,
          "description": "Game clock stops after a made field goal in the final 2:00 of Q4 and any overtime period. Pinned true for v0.1.0."
        }
      }
    },
    "durations": {
      "type": "array",
      "minItems": 14,
      "maxItems": 15,
      "items": {
        "$ref": "#/$defs/durationEntry"
      },
      "$comment": "Closed 14-entry catalog for v0.1.0. Uniqueness of `id` and the presence of every documented ID are enforced by scripts/check-foundation.mjs (todo 9 linter) and by the jq '.durations | length' and per-id jq verification gates; JSON Schema draft-07 has no portable way to pin the exact id set."
    },
    "start_reason_bias": {
      "type": "object",
      "required": [
        "after_make",
        "after_defensive_rebound",
        "after_steal",
        "after_turnover",
        "after_offensive_rebound",
        "after_inbound",
        "after_jump_ball"
      ],
      "additionalProperties": false,
      "properties": {
        "after_make": {
          "$ref": "#/$defs/biasEntry"
        },
        "after_defensive_rebound": {
          "$ref": "#/$defs/biasEntry"
        },
        "after_steal": {
          "$ref": "#/$defs/biasEntry"
        },
        "after_turnover": {
          "$ref": "#/$defs/biasEntry"
        },
        "after_offensive_rebound": {
          "$ref": "#/$defs/biasEntryWithShotClockReset"
        },
        "after_inbound": {
          "$ref": "#/$defs/biasEntry"
        },
        "after_jump_ball": {
          "$ref": "#/$defs/biasEntry"
        }
      }
    }
  },
  "$defs": {
    "durationEntry": {
      "type": "object",
      "required": [
        "id",
        "distribution",
        "min",
        "max"
      ],
      "additionalProperties": false,
      "properties": {
        "id": {
          "type": "string",
          "pattern": "^[a-z][a-z0-9_]*$",
          "minLength": 1,
          "description": "Duration identifier cross-referenced by plays.json (T8). Lowercase snake_case."
        },
        "distribution": {
          "type": "string",
          "enum": [
            "uniform",
            "trunc_normal"
          ],
          "description": "Sampling distribution. v0.1.0 freeze: only `uniform` is used; `trunc_normal` is reserved for future tuning and is rejected by the foundation linter until a play explicitly references it."
        },
        "min": {
          "type": "number",
          "minimum": 0,
          "description": "Lower bound (seconds). For uniform this is the inclusive min; for trunc_normal it is the truncation floor. Must satisfy min <= max (enforced by scripts/check-foundation.mjs in todo 9; JSON Schema draft-07 cannot express this without ajv's $data extension, which is intentionally not loaded by ajv-cli strict mode)."
        },
        "max": {
          "type": "number",
          "minimum": 0,
          "description": "Upper bound (seconds). For uniform this is the exclusive-ish max; for trunc_normal it is the truncation ceiling."
        }
      }
    },
    "biasEntry": {
      "type": "object",
      "required": [
        "mode",
        "align_extra_seconds"
      ],
      "additionalProperties": false,
      "properties": {
        "mode": {
          "type": "string",
          "enum": [
            "HALFCOURT",
            "TRANSITION"
          ],
          "description": "Possession mode the engine selects for this start reason (decision M4: only HALFCOURT | TRANSITION in v0.1.0)."
        },
        "align_extra_seconds": {
          "type": "number",
          "minimum": 0,
          "description": "Extra time added on top of the align_halfcourt duration sample when the possession enters HALFCOURT from a dead-ball start. after_make adds ~1.5s to push mean possession length toward the target ~17s band; transition starts typically use 0."
        }
      }
    },
    "biasEntryWithShotClockReset": {
      "type": "object",
      "required": [
        "mode",
        "align_extra_seconds",
        "shot_clock_reset_to"
      ],
      "additionalProperties": false,
      "properties": {
        "mode": {
          "type": "string",
          "enum": [
            "HALFCOURT",
            "TRANSITION"
          ]
        },
        "align_extra_seconds": {
          "type": "number",
          "minimum": 0
        },
        "shot_clock_reset_to": {
          "type": "integer",
          "minimum": 1,
          "const": 14,
          "description": "For after_offensive_rebound: shot clock resets to clocks.shot_clock_reset (14) per the v0.1.0 subset rule. Pinned at 14."
        }
      }
    }
  }
}